{
  "schemaVersion": 1,
  "id": "data-platform",
  "name": "Data Platform",
  "description": "Owns reusable policies, knowledge, Skills, Agents, and Hooks for enterprise data platforms.",
  "owners": ["data-platform-leadership"],
  "policyApprovers": ["data-governance"],
  "maintainers": ["data-platform-engineering"],
  "contributionMode": {
    "artifacts": "reviewed",
    "policies": "restricted",
    "knowledge": "reviewed",
    "skills": "restricted",
    "agents": "restricted",
    "hooks": "restricted"
  }
}
